{
 "schema_version": "1.0",
 "contract_version": "1.2.0",
 "generated_at": "2026-10-23",
 "source": {
  "matches": 28,
  "rounds": 599,
  "maps": [
   "de_ancient",
   "de_anubis",
   "de_cache",
   "de_dust2",
   "de_inferno",
   "de_mirage",
   "de_nuke"
  ]
 },
 "thresholds": {
  "min_n": 30,
  "z_warn": 3.0,
  "z_fail": 5.0,
  "prop_tol": 0.03,
  "rel_tol": 0.05,
  "cov_tol": 0.05
 },
 "metrics": {
  "buy.armor_rate.CT": {
   "kind": "prop",
   "k": 2555,
   "n": 2715,
   "value": 0.94107,
   "between": {
    "matches": 28,
    "sd": 0.0356
   },
   "desc": "Fração dos jogadores com colete (rounds sem pistola)."
  },
  "buy.armor_rate.T": {
   "kind": "prop",
   "k": 2437,
   "n": 2715,
   "value": 0.89761,
   "between": {
    "matches": 28,
    "sd": 0.04957
   },
   "desc": "Fração dos jogadores com colete (rounds sem pistola)."
  },
  "buy.awp_per_team.CT": {
   "kind": "mean",
   "mean": 0.68324,
   "std": 0.58189,
   "n": 543,
   "between": {
    "matches": 28,
    "sd": 0.21338
   },
   "desc": "AWPs por time por round (rounds sem pistola)."
  },
  "buy.awp_per_team.T": {
   "kind": "mean",
   "mean": 0.33517,
   "std": 0.47638,
   "n": 543,
   "between": {
    "matches": 28,
    "sd": 0.1635
   },
   "desc": "AWPs por time por round (rounds sem pistola)."
  },
  "buy.grenades_per_player.flash": {
   "kind": "mean",
   "mean": 0.93002,
   "std": 0.66258,
   "n": 5430,
   "between": {
    "matches": 28,
    "sd": 0.07013
   },
   "desc": "Granadas por jogador no fim do freeze time (rounds sem pistola)."
  },
  "buy.grenades_per_player.he": {
   "kind": "mean",
   "mean": 0.52394,
   "std": 0.49947,
   "n": 5430,
   "between": {
    "matches": 28,
    "sd": 0.04414
   },
   "desc": "Granadas por jogador no fim do freeze time (rounds sem pistola)."
  },
  "buy.grenades_per_player.molotov": {
   "kind": "mean",
   "mean": 0.70442,
   "std": 0.45635,
   "n": 5430,
   "between": {
    "matches": 28,
    "sd": 0.05461
   },
   "desc": "Granadas por jogador no fim do freeze time (rounds sem pistola)."
  },
  "buy.grenades_per_player.smoke": {
   "kind": "mean",
   "mean": 0.85967,
   "std": 0.34736,
   "n": 5430,
   "between": {
    "matches": 28,
    "sd": 0.02925
   },
   "desc": "Granadas por jogador no fim do freeze time (rounds sem pistola)."
  },
  "buy.helmet_rate.CT": {
   "kind": "prop",
   "k": 1918,
   "n": 2715,
   "value": 0.70645,
   "between": {
    "matches": 28,
    "sd": 0.1296
   },
   "desc": "Fração dos jogadores com capacete (rounds sem pistola)."
  },
  "buy.helmet_rate.T": {
   "kind": "prop",
   "k": 2273,
   "n": 2715,
   "value": 0.8372,
   "between": {
    "matches": 28,
    "sd": 0.06921
   },
   "desc": "Fração dos jogadores com capacete (rounds sem pistola)."
  },
  "buy.kit_rate.CT": {
   "kind": "prop",
   "k": 1274,
   "n": 2715,
   "value": 0.46924,
   "between": {
    "matches": 28,
    "sd": 0.14245
   },
   "desc": "Fração dos CTs com kit de defuse (rounds sem pistola)."
  },
  "buy.type.CT.eco": {
   "kind": "prop",
   "k": 25,
   "n": 599,
   "value": 0.04174,
   "between": {
    "matches": 28,
    "sd": 0.04771
   },
   "desc": "Fração dos rounds de cada lado por tipo de compra."
  },
  "buy.type.CT.force": {
   "kind": "prop",
   "k": 68,
   "n": 599,
   "value": 0.11352,
   "between": {
    "matches": 28,
    "sd": 0.07989
   },
   "desc": "Fração dos rounds de cada lado por tipo de compra."
  },
  "buy.type.CT.full": {
   "kind": "prop",
   "k": 450,
   "n": 599,
   "value": 0.75125,
   "between": {
    "matches": 28,
    "sd": 0.08543
   },
   "desc": "Fração dos rounds de cada lado por tipo de compra."
  },
  "buy.type.CT.pistol": {
   "kind": "prop",
   "k": 56,
   "n": 599,
   "value": 0.09349,
   "between": {
    "matches": 28,
    "sd": 0.01447
   },
   "desc": "Fração dos rounds de cada lado por tipo de compra."
  },
  "buy.type.T.eco": {
   "kind": "prop",
   "k": 46,
   "n": 599,
   "value": 0.07679,
   "between": {
    "matches": 28,
    "sd": 0.04806
   },
   "desc": "Fração dos rounds de cada lado por tipo de compra."
  },
  "buy.type.T.force": {
   "kind": "prop",
   "k": 85,
   "n": 599,
   "value": 0.1419,
   "between": {
    "matches": 28,
    "sd": 0.08184
   },
   "desc": "Fração dos rounds de cada lado por tipo de compra."
  },
  "buy.type.T.full": {
   "kind": "prop",
   "k": 412,
   "n": 599,
   "value": 0.68781,
   "between": {
    "matches": 28,
    "sd": 0.09239
   },
   "desc": "Fração dos rounds de cada lado por tipo de compra."
  },
  "buy.type.T.pistol": {
   "kind": "prop",
   "k": 56,
   "n": 599,
   "value": 0.09349,
   "between": {
    "matches": 28,
    "sd": 0.01447
   },
   "desc": "Fração dos rounds de cada lado por tipo de compra."
  },
  "combat.accuracy.awp": {
   "kind": "prop",
   "k": 469,
   "n": 862,
   "value": 0.54408,
   "between": {
    "matches": 28,
    "sd": 0.08734
   },
   "desc": "Taxa de acerto em tiros de combate (mira a menos de 10° de um inimigo, ou que acertaram)."
  },
  "combat.accuracy.pistol": {
   "kind": "prop",
   "k": 1976,
   "n": 8198,
   "value": 0.24103,
   "between": {
    "matches": 28,
    "sd": 0.04236
   },
   "desc": "Taxa de acerto em tiros de combate (mira a menos de 10° de um inimigo, ou que acertaram)."
  },
  "combat.accuracy.pistol.0-10m": {
   "kind": "prop",
   "k": 520,
   "n": 1259,
   "value": 0.41303,
   "between": {
    "matches": 28,
    "sd": 0.08657
   },
   "desc": "Taxa de acerto em tiros de combate (mira a menos de 10° de um inimigo, ou que acertaram)."
  },
  "combat.accuracy.pistol.10-20m": {
   "kind": "prop",
   "k": 840,
   "n": 3038,
   "value": 0.2765,
   "between": {
    "matches": 28,
    "sd": 0.04888
   },
   "desc": "Taxa de acerto em tiros de combate (mira a menos de 10° de um inimigo, ou que acertaram)."
  },
  "combat.accuracy.pistol.20-30m": {
   "kind": "prop",
   "k": 416,
   "n": 2115,
   "value": 0.19669,
   "between": {
    "matches": 28,
    "sd": 0.07832
   },
   "desc": "Taxa de acerto em tiros de combate (mira a menos de 10° de um inimigo, ou que acertaram)."
  },
  "combat.accuracy.pistol.30m+": {
   "kind": "prop",
   "k": 200,
   "n": 1786,
   "value": 0.11198,
   "between": {
    "matches": 28,
    "sd": 0.06689
   },
   "desc": "Taxa de acerto em tiros de combate (mira a menos de 10° de um inimigo, ou que acertaram)."
  },
  "combat.accuracy.rifle": {
   "kind": "prop",
   "k": 8343,
   "n": 32954,
   "value": 0.25317,
   "between": {
    "matches": 28,
    "sd": 0.04317
   },
   "desc": "Taxa de acerto em tiros de combate (mira a menos de 10° de um inimigo, ou que acertaram)."
  },
  "combat.accuracy.rifle.0-10m": {
   "kind": "prop",
   "k": 1563,
   "n": 3436,
   "value": 0.45489,
   "between": {
    "matches": 28,
    "sd": 0.06404
   },
   "desc": "Taxa de acerto em tiros de combate (mira a menos de 10° de um inimigo, ou que acertaram)."
  },
  "combat.accuracy.rifle.10-20m": {
   "kind": "prop",
   "k": 3370,
   "n": 9470,
   "value": 0.35586,
   "between": {
    "matches": 28,
    "sd": 0.0649
   },
   "desc": "Taxa de acerto em tiros de combate (mira a menos de 10° de um inimigo, ou que acertaram)."
  },
  "combat.accuracy.rifle.20-30m": {
   "kind": "prop",
   "k": 2243,
   "n": 9069,
   "value": 0.24733,
   "between": {
    "matches": 28,
    "sd": 0.0612
   },
   "desc": "Taxa de acerto em tiros de combate (mira a menos de 10° de um inimigo, ou que acertaram)."
  },
  "combat.accuracy.rifle.30m+": {
   "kind": "prop",
   "k": 1167,
   "n": 10979,
   "value": 0.10629,
   "between": {
    "matches": 28,
    "sd": 0.04923
   },
   "desc": "Taxa de acerto em tiros de combate (mira a menos de 10° de um inimigo, ou que acertaram)."
  },
  "combat.accuracy.smg": {
   "kind": "prop",
   "k": 955,
   "n": 3008,
   "value": 0.31749,
   "between": {
    "matches": 28,
    "sd": 0.11233
   },
   "desc": "Taxa de acerto em tiros de combate (mira a menos de 10° de um inimigo, ou que acertaram)."
  },
  "combat.accuracy.smg.0-10m": {
   "kind": "prop",
   "k": 316,
   "n": 712,
   "value": 0.44382,
   "between": {
    "matches": 26,
    "sd": 0.13248
   },
   "desc": "Taxa de acerto em tiros de combate (mira a menos de 10° de um inimigo, ou que acertaram)."
  },
  "combat.accuracy.smg.10-20m": {
   "kind": "prop",
   "k": 450,
   "n": 1215,
   "value": 0.37037,
   "between": {
    "matches": 25,
    "sd": 0.11289
   },
   "desc": "Taxa de acerto em tiros de combate (mira a menos de 10° de um inimigo, ou que acertaram)."
  },
  "combat.accuracy.smg.20-30m": {
   "kind": "prop",
   "k": 169,
   "n": 780,
   "value": 0.21667,
   "between": {
    "matches": 25,
    "sd": 0.22844
   },
   "desc": "Taxa de acerto em tiros de combate (mira a menos de 10° de um inimigo, ou que acertaram)."
  },
  "combat.accuracy.smg.30m+": {
   "kind": "prop",
   "k": 20,
   "n": 301,
   "value": 0.06645,
   "between": {
    "matches": 16,
    "sd": 0.13444
   },
   "desc": "Taxa de acerto em tiros de combate (mira a menos de 10° de um inimigo, ou que acertaram)."
  },
  "combat.adr": {
   "kind": "mean",
   "mean": 75.42354,
   "std": 83.35728,
   "n": 5990,
   "between": {
    "matches": 28,
    "sd": 3.45899
   },
   "desc": "Dano médio por round por jogador (cada vítima conta no máximo 100)."
  },
  "combat.aim_error_first_bullet_deg": {
   "kind": "quantiles",
   "q": {
    "p5": 0.35701,
    "p10": 0.5305,
    "p25": 0.96903,
    "p50": 1.8838,
    "p75": 3.91922,
    "p90": 6.82893,
    "p95": 8.1656
   },
   "mean": 2.81611,
   "n": 18382,
   "between": {
    "matches": 28,
    "sd_cov": {
     "p10": 0.02946,
     "p25": 0.05464,
     "p50": 0.07384,
     "p75": 0.05685,
     "p90": 0.03294
    }
   },
   "coverage": {
    "p10": 0.10004,
    "p25": 0.25003,
    "p50": 0.5,
    "p75": 0.74997,
    "p90": 0.89996
   },
   "desc": "Erro de mira da primeira bala, em graus."
  },
  "combat.burst_length": {
   "kind": "quantiles",
   "q": {
    "p5": 1.0,
    "p10": 1.0,
    "p25": 1.0,
    "p50": 4.0,
    "p75": 7.0,
    "p90": 10.0,
    "p95": 13.0
   },